{
	"$schema": "risks",
	"label": "stETH accumulator v2",
	"codeReviewScore": 3,
	"testingScore": 3,
	"auditScore": 5,
	"protocolSafetyScore": 2,
	"complexityScore": 1,
	"teamKnowledgeScore": 2,
	"criteria": {
		"nameLike": [
			"StrategystETHAccumulator_v2"
		],
		"strategies": [],
		"exclude": [
			"StrategystETHAccumulator"
		]
	}
}