{
	"$schema": "risks",
	"label": "IL-Hedge Hedgil V2 Spooky Liquidity Provider",
	"codeReviewScore": 3,
	"testingScore": 2,
	"auditScore": 5,
	"protocolSafetyScore": 3,
	"complexityScore": 4,
	"teamKnowledgeScore": 2,
	"criteria": {
		"nameLike": [
			"ToHedgilSpookyJoint"
		],
		"strategies": [],
		"exclude": []
	}
}