{
	"$schema": "risks",
	"label": "Geist Lender Borrower",
	"codeReviewScore": 2,
	"testingScore": 2,
	"auditScore": 5,
	"protocolSafetyScore": 3,
	"complexityScore": 4,
	"teamKnowledgeScore": 2,
	"criteria": {
		"nameLike": [
			"GeistMIMLender",
			"GeistDAILender",
			"GeistfUSDTLender",
			"GeistUSDCLender",
			"GeistWFTMLender"
		],
		"strategies": [],
		"exclude": []
	}
}