{
	"$schema": "risks",
	"label": "Others",
	"codeReviewScore": 5,
	"testingScore": 5,
	"auditScore": 5,
	"protocolSafetyScore": 5,
	"complexityScore": 5,
	"teamKnowledgeScore": 5,
	"criteria": {
		"nameLike": [
			"IBLevComp"
		],
		"strategies": [],
		"exclude": [
			"1INCHGovernance",
			"88MPH",
			"SSBv3",
			"SingleSidedBalancer",
			"SingleSidedBoostedBalancer",
			"StkAaveCooldown",
			"StrategyLiquityStabilityPoolLUSD",
			"StrategyNotionalLP",
			"StrategyNotionalLending",
			"StrategyTokemak",
			"StrategyYearnVECRV",
			"ToHegicSushiJoint",
			"WETHSingleSided",
			"aave",
			"accumulator",
			"ah",
			"ah2",
			"borrower",
			"convex",
			"crv",
			"curve",
			"genericlender",
			"genericlevaave",
			"genericlevcomp",
			"genlevaave",
			"genlevcomp",
			"idle",
			"inverse",
			"kashi",
			"maker",
			"makerv2",
			"pooltogether",
			"rook",
			"router",
			"singlesided",
			"snx",
			"snxstaking",
			"ssc",
			"stargate",
			"strategyangle",
			"strategylender",
			"stratmm",
			"synthetix",
			"vesper",
			"xsushi-staker",
			"NoHedgeUniV3StablesJoint",
			"strategygoldfinch",
			"auto-compounding aura",
			"maker-lev",
			"convextempledao-u"
		]
	}
}