{
	"$schema": "risks",
	"label": "Convex Factory",
	"codeReviewScore": 2,
	"testingScore": 3,
	"auditScore": 4,
	"protocolSafetyScore": 2,
	"complexityScore": 2,
	"teamKnowledgeScore": 1,
	"criteria": {
		"nameLike": [
            "strategyconvexfactory"
		],
		"strategies": [],
		"exclude": [
            "convex",
            "strategyconvexfraxfactory"
		]
	}
}